{
 "SCALE": {
  "perStage": 0.1,
  "bond3": 1.25,
  "bond5": 1.5,
  "hybrid": 0.8,
  "keepCoinCap": 0.6,
  "rootOnce": true
 },
 "BUILDINGS": {
  "cost": [
   null,
   {},
   {
    "coin": 150,
    "ore": 15,
    "rank": 3
   },
   {
    "coin": 400,
    "ingot": 12,
    "glass": 6,
    "rank": 12
   },
   {
    "coin": 900,
    "ingot": 20,
    "glass": 10,
    "cloth": 8,
    "rank": 20
   },
   {
    "coin": 1600,
    "ingot": 30,
    "glass": 16,
    "cloth": 12,
    "rank": 30
   }
  ],
  "levels": {
   "forge": [
    "Craft tier 1 weapons",
    "Craft tier 2 weapons",
    "Gilded cages",
    "Craft tier 3 weapons",
    "Craft tier 4 weapons"
   ],
   "garden": [
    "Beds grow 10% more",
    "Beds grow 20% more",
    "Beds grow 35% more",
    "Beds grow 50% more",
    "Beds grow 70% more"
   ],
   "spring": [
    "Creatures heal 50% a day (35% with nobody posted)",
    "Creatures heal fully each day",
    "Bathhouse: creatures shed 10 more fatigue on a day off"
   ],
   "roost": [
    "Expeditions and vein maps",
    "+30% wild creature encounters in raids"
   ],
   "vault": [
    "Keep your slot 3 creature if you die",
    "Keep 15% of raid coin if you die"
   ],
   "nursery": [
    "One egg at a time, hatching in 2 days",
    "Two eggs at once",
    "Eggs hatch in 1 day",
    "Hybrid odds 15%",
    "Three eggs at once, hybrid odds 20%"
   ],
   "training": [
    "Trainees gain 30 XP a day",
    "45 XP a day and the Gene Lab",
    "60 XP a day",
    "75 XP a day and the Trait Tutor",
    "100 XP a day"
   ],
   "warroom": [
    "The Hunter’s Moon mode",
    "The Iron Will mode",
    "The Swarm mode"
   ],
   "apothecary": [
    "Brews gene serums",
    "Wild Venom creatures outside the Sump",
    "Brews 25% more"
   ]
  },
  "springHeal": [
   0.35,
   0.5,
   1,
   1
  ],
  "springRest": [
   0,
   0,
   0,
   10
  ],
  "vaultCoin": [
   0,
   0,
   0.15
  ],
  "trainingXp": [
   20,
   30,
   45,
   60,
   75,
   100
  ],
  "eggCap": [
   0,
   1,
   2,
   2,
   2,
   3
  ],
  "hatchDays": [
   2,
   2,
   2,
   1,
   1,
   1
  ],
  "hybridOdds": [
   0.1,
   0.1,
   0.1,
   0.1,
   0.15,
   0.2
  ],
  "craftTier": [
   0,
   1,
   2,
   2,
   3,
   4
  ],
  "gildedLevel": 3,
  "wildLevel": 2,
  "venomWildLevel": 2,
  "workers": {
   "needed": 1
  }
 },
 "LINES": {
  "cindlet": [
   "kindler",
   "restless",
   "forgemaster"
  ],
  "pyrrox": [
   "scrapper",
   "showoff",
   "brightsmelt"
  ],
  "magmaul": [
   "heatsink",
   "slowstart",
   "crucible"
  ],
  "puffcap": [
   "greenthumb",
   "homebody",
   "harvestking"
  ],
  "shroomite": [
   "ploughman",
   "glutton",
   "compost"
  ],
  "mycelisk": [
   "rootnet",
   "shy",
   "deeproots"
  ],
  "dewdrip": [
   "healtouch",
   "frailshell",
   "tidalward"
  ],
  "coralisk": [
   "reefkeeper",
   "territorial",
   "coralbulwark"
  ],
  "tidewyrm": [
   "deepcalm",
   "heavysleeper",
   "lifeguard"
  ],
  "chirrup": [
   "mapper",
   "chatterbox",
   "pathfinder"
  ],
  "vesperbat": [
   "nightscout",
   "lightshy",
   "duskcaller"
  ],
  "umbrowl": [
   "hollowears",
   "brooding",
   "forecast"
  ],
  "zephling": [
   "tailwind",
   "flighty",
   "galeshield"
  ],
  "kestrix": [
   "drillsgt",
   "hottemper",
   "bossbreaker"
  ],
  "stormwing": [
   "stormcaller",
   "bigappetite",
   "eyestorm"
  ],
  "shardling": [
   "coinkeeper",
   "brittleshell",
   "diamondvault"
  ],
  "prismoth": [
   "lightbender",
   "distractible",
   "aurora"
  ],
  "geodon": [
   "strongbox",
   "slowlearner",
   "citadel"
  ],
  "pebblet": [
   "nestwarmer",
   "clumsypaws",
   "warmclutch"
  ],
  "bastion": [
   "broodkeeper",
   "stubborn",
   "twinnests"
  ],
  "monolord": [
   "ancestral",
   "aloof",
   "pantheon"
  ],
  "toxlet": [
   "brewer",
   "toxic",
   "masterbrewer"
  ],
  "fangmire": [
   "poisoner",
   "coldblooded",
   "basiliskgaze"
  ],
  "hydravine": [
   "antidote",
   "threemouths",
   "bloomcure"
  ],
  "glimmet": [
   "archivist",
   "nightowl",
   "lantern"
  ],
  "halowing": [
   "dawnsong",
   "fragile",
   "seraphsong"
  ],
  "solaryx": [
   "sunlamp",
   "proud",
   "midsummer"
  ]
 },
 "HYBRIDS": {
  "blazewing": [
   "cindlet",
   "zephling",
   "volatile"
  ],
  "bogbloom": [
   "coralisk",
   "puffcap",
   "soggy"
  ],
  "resonyx": [
   "prismoth",
   "chirrup",
   "echoing"
  ],
  "forgeheart": [
   "bastion",
   "cindlet",
   "heavyframe"
  ],
  "squallfin": [
   "stormwing",
   "dewdrip",
   "squalls"
  ],
  "duskcap": [
   "puffcap",
   "umbrowl",
   "nocturne"
  ],
  "gemguard": [
   "shardling",
   "pebblet",
   "gemhunger"
  ],
  "steamfin": [
   "pyrrox",
   "coralisk",
   "scalding"
  ],
  "kilnspark": [
   "magmaul",
   "prismoth",
   "brittleglaze"
  ],
  "mossguard": [
   "shroomite",
   "monolord",
   "rootbound"
  ],
  "deepsinger": [
   "tidewyrm",
   "vesperbat",
   "lonesong"
  ],
  "glasswing": [
   "kestrix",
   "geodon",
   "thinwings"
  ],
  "wailwind": [
   "zephling",
   "umbrowl",
   "howler"
  ],
  "blightcap": [
   "toxlet",
   "mycelisk",
   "rotting"
  ],
  "mirefang": [
   "fangmire",
   "dewdrip",
   "brackish"
  ],
  "dawnsong": [
   "halowing",
   "chirrup",
   "starstruck"
  ],
  "prismheart": [
   "solaryx",
   "shardling",
   "glare"
  ],
  "eclipsar": [
   "hydravine",
   "glimmet",
   "duskbound"
  ]
 },
 "PERSONALITY": {
  "brave": [
   "p_brave",
   "f_brave"
  ],
  "timid": [
   "p_timid",
   "f_timid"
  ],
  "greedy": [
   "p_greedy",
   "f_greedy"
  ],
  "curious": [
   "p_curious",
   "f_curious"
  ],
  "loyal": [
   "p_loyal",
   "f_loyal"
  ],
  "fierce": [
   "p_fierce",
   "f_fierce"
  ],
  "calm": [
   "p_calm",
   "f_calm"
  ],
  "playful": [
   "p_playful",
   "f_playful"
  ]
 },
 "EARNED": {
  "hand": {
   "days": 30
  },
  "veteran": {
   "extracts": 25
  },
  "survivor": {
   "nearDeaths": 3
  },
  "bossbane": {
   "title": "wyrmslayer"
  },
  "burntout": {
   "maxed": 3,
   "within": 10,
   "clearOff": 5
  },
  "homesick": {
   "days": 30
  }
 },
 "PERKS": {
  "kindler": {
   "name": "Kindler",
   "kind": "perk",
   "desc": "+15% Forge output",
   "at": "station",
   "st": "forge",
   "fx": {
    "out": 0.15
   }
  },
  "restless": {
   "name": "Restless",
   "kind": "flaw",
   "desc": "Tires 25% faster at any station",
   "at": "station",
   "st": "any",
   "fx": {
    "tire": 0.25
   }
  },
  "scrapper": {
   "name": "Scrapper",
   "kind": "perk",
   "desc": "+50% ore from scrapping weapons, while at the Forge",
   "at": "station",
   "st": "forge",
   "fx": {
    "scrapOre": 0.5
   }
  },
  "showoff": {
   "name": "Showoff",
   "kind": "flaw",
   "desc": "−10% output when it is the only worker",
   "at": "station",
   "st": "any",
   "fx": {
    "soloOut": -0.1
   }
  },
  "heatsink": {
   "name": "Heat Sink",
   "kind": "perk",
   "desc": "Crewmates at its station tire 30% slower",
   "at": "station",
   "st": "any",
   "fx": {
    "crewTire": -0.3
   }
  },
  "slowstart": {
   "name": "Slow Start",
   "kind": "flaw",
   "desc": "Half output on its first day at a new station",
   "at": "station",
   "st": "any",
   "fx": {
    "settle": {
     "days": 1,
     "out": -0.5
    }
   }
  },
  "greenthumb": {
   "name": "Green Thumb",
   "kind": "perk",
   "desc": "+20% Garden output",
   "at": "station",
   "st": "garden",
   "fx": {
    "out": 0.2
   }
  },
  "homebody": {
   "name": "Homebody",
   "kind": "flaw",
   "desc": "−10% damage in raids",
   "at": "party",
   "fx": {
    "dmg": -0.1
   }
  },
  "ploughman": {
   "name": "Ploughman",
   "kind": "perk",
   "desc": "+1 food a day while at the Garden",
   "at": "station",
   "st": "garden",
   "fx": {
    "make": {
     "food": 1
    }
   }
  },
  "glutton": {
   "name": "Glutton",
   "kind": "flaw",
   "desc": "Eats 2 food a day",
   "at": "home",
   "fx": {
    "food": 1
   }
  },
  "rootnet": {
   "name": "Root Network",
   "kind": "perk",
   "desc": "+3% output at every station (one counts)",
   "at": "station",
   "st": "any",
   "fx": {
    "allOut": 0.03
   }
  },
  "shy": {
   "name": "Shy",
   "kind": "flaw",
   "desc": "Won’t work at the War Room",
   "at": "station",
   "st": "warroom",
   "fx": {
    "refuse": true
   }
  },
  "healtouch": {
   "name": "Healer’s Touch",
   "kind": "perk",
   "desc": "The Spring heals 25% more",
   "at": "station",
   "st": "spring",
   "fx": {
    "heal": 0.25
   }
  },
  "frailshell": {
   "name": "Frail Shell",
   "kind": "flaw",
   "desc": "−10% max HP in raids",
   "at": "party",
   "fx": {
    "hp": -0.1
   }
  },
  "reefkeeper": {
   "name": "Reef Keeper",
   "kind": "perk",
   "desc": "+20% tonics at the Spring",
   "at": "station",
   "st": "spring",
   "fx": {
    "out": 0.2
   }
  },
  "territorial": {
   "name": "Territorial",
   "kind": "flaw",
   "desc": "Clashes with another of its line at its station",
   "at": "station",
   "st": "any",
   "fx": {
    "clashLine": true
   }
  },
  "deepcalm": {
   "name": "Deep Calm",
   "kind": "perk",
   "desc": "Crewmates at the Spring tire 20% slower",
   "at": "station",
   "st": "spring",
   "fx": {
    "crewTire": -0.2
   }
  },
  "heavysleeper": {
   "name": "Heavy Sleeper",
   "kind": "flaw",
   "desc": "Tires 30% faster at any station",
   "at": "station",
   "st": "any",
   "fx": {
    "tire": 0.3
   }
  },
  "mapper": {
   "name": "Mapper",
   "kind": "perk",
   "desc": "Reveals the full floor map in raids, while at the Roost",
   "at": "station",
   "st": "roost",
   "fx": {
    "reveal": "map"
   }
  },
  "chatterbox": {
   "name": "Chatterbox",
   "kind": "flaw",
   "desc": "Crewmates −5% output",
   "at": "station",
   "st": "any",
   "fx": {
    "crewOut": -0.05
   }
  },
  "nightscout": {
   "name": "Night Scout",
   "kind": "perk",
   "desc": "Marks rooms with rare creatures in raids, while at the Roost",
   "at": "station",
   "st": "roost",
   "fx": {
    "reveal": "rare"
   }
  },
  "lightshy": {
   "name": "Light-shy",
   "kind": "flaw",
   "desc": "Won’t work at the Vault",
   "at": "station",